"b""I don't force myself now into doing some tasks because the effort is stressing me out. I just allow the depression\xe2\x80\xa6 https://t.co/3rPTRa9LbT""",b'@Jacobji01 @prakashraaj We can understand your depression.',b'Depression. Mental illness. Misunderstood. Overlooked. Sad. Sad.\nMay she R.I.P.\nhttps://t.co/Ui8Pa8A4P1',b'Prevelance of Post stroke depression - is there a gender dofferenc? Do we brush it aside &amp; not actually consider it\xe2\x80\xa6 https://t.co/OFnhaO1ifu',"b'confusedthin: feathers-weightless: deaddei: Secrets like depression, eating disorders, self harm, or... https://t.co/0f3UeHvWV8'",b'Me: joking abt my depression/anxiety helps\n\n\xe2\x80\x9cDude same\xe2\x80\x9d\n\nMe: The endless white noise that is our meaningless existe\xe2\x80\xa6 https://t.co/2eFxc1B3Fp',b'SPEAK UP SETX | Do you think depression is a problem in SETX?\nWatch your vote count on-air during 12News Daybreak.\xe2\x80\xa6 https://t.co/xUoVbayVNR',b'Rates of anxiety and depression in young people have increased by 70% over the past 25 years. Exam stress can contr\xe2\x80\xa6 https://t.co/7jLOzY2qpv',b'Depression does not discriminate. https://t.co/hTjRuzAOUz',b'4/5 badly by depression and agoraphobia...my cousins helped me to start jamming with them at home-we recorded and w\xe2\x80\xa6 https://t.co/pJSAcv9u2W',b'I liked a @YouTube video https://t.co/twr1HTNZVA summer depression / @buzry32',"b""Depression aka i haven't washed my hair in days and im tired even though all I've done is lay in bed all day""",b'@EdnaOjeh \xf0\x9f\x98\x82\xf0\x9f\x98\x82\xf0\x9f\x98\x82\xf0\x9f\x98\x82Depression taking its toll',b'This is disappointing. Depression does not discriminate. https://t.co/512oo74SXX',"b'@khaleesi_britt People who think ""depression"" means ""being a bit sad""...'","b""@HopeAtha who does that thou ? let's say they dont know whats depression. askies hope you find someone who might be\xe2\x80\xa6 https://t.co/fJSIsaq9HT""",b'Privilege can help you cope better what with more access to services and ability to take time off to heal but doesn\xe2\x80\xa6 https://t.co/5lKW6qUEEx',b'Buy Stilnoct CR 12.5mg Online To Solve insomnia Problem   https://t.co/WGRMZse4Ay  #health #ambien #stilnoct\xe2\x80\xa6 https://t.co/MsRCWWa8AS',"b'We\xe2\x80\x99ve been doing great at raising awareness for anx and depression. Now we need to create a platform for psychosis,\xe2\x80\xa6 https://t.co/LuAYf9eEkl'","b'@jaicpn I think the book shows how depression doesn\xe2\x80\x99t really go away easily(it needs time, care and hope) and how s\xe2\x80\xa6 https://t.co/z4gOykWtsu'","b""I don't force myself now into doing some tasks because the effort is stressing me out. I just allow the depression\xe2\x80\xa6 https://t.co/3rPTRa9LbT""",b'@Jacobji01 @prakashraaj We can understand your depression.',b'Depression. Mental illness. Misunderstood. Overlooked. Sad. Sad.\nMay she R.I.P.\nhttps://t.co/Ui8Pa8A4P1',b'Prevelance of Post stroke depression - is there a gender dofferenc? Do we brush it aside &amp; not actually consider it\xe2\x80\xa6 https://t.co/OFnhaO1ifu',"b'confusedthin: feathers-weightless: deaddei: Secrets like depression, eating disorders, self harm, or... https://t.co/0f3UeHvWV8'",b'Me: joking abt my depression/anxiety helps\n\n\xe2\x80\x9cDude same\xe2\x80\x9d\n\nMe: The endless white noise that is our meaningless existe\xe2\x80\xa6 https://t.co/2eFxc1B3Fp',b'SPEAK UP SETX | Do you think depression is a problem in SETX?\nWatch your vote count on-air during 12News Daybreak.\xe2\x80\xa6 https://t.co/xUoVbayVNR',b'Rates of anxiety and depression in young people have increased by 70% over the past 25 years. Exam stress can contr\xe2\x80\xa6 https://t.co/7jLOzY2qpv',b'Next talk by #profanthonycleare on optimising treatment in #depression https://t.co/mWHRy851Rh',"b""#depression, #suicide, frustration, fear, anger - are things many experience. Especially entrepreneurs. I'll speak\xe2\x80\xa6 https://t.co/L2gZhWgNhc""","b'- an identifiable thing, how many asexuals would\xe2\x80\x99ve been misdiagnosed and treated for SAD, HSDD, depression, hormon\xe2\x80\xa6 https://t.co/0J8Oz82FBM'","b'Disruption of circadian rhythm is associated with #mood disorders, including depression and #bipolardisorder . https://t.co/JfnT1mR1wZ'",b'Why be asleep of be doing homework when i can sink deeper in to a depression spiral lol',"b""When we hit 10,000 subs on @youtube we were so happy! Bronz Status!  Now at 14,000 subs, it's irrelevant.  No perks\xe2\x80\xa6 https://t.co/wuJMX6U0sq""",b'#MentalHealthWeek \nI\xe2\x80\x99ve been struggling with depression/ anxiety for years. I can finally say I\xe2\x80\x99m on the road to recovery \xf0\x9f\x99\x8c',b'@sikka_harinder Hope wherever sehmat n her parents n husband who loved her so much that he sacrificed his own life\xe2\x80\xa6 https://t.co/5OYhHT3khr',b'Male depression may cause infertility:\xc2\xa0study https://t.co/Cugseq1IlW https://t.co/kUlUjoWt0u',b'Who else is up rn other than me and can\xe2\x80\x99t sleep through their depression ? \xf0\x9f\x92\x81\xf0\x9f\x8f\xbd\xe2\x80\x8d\xe2\x99\x80\xef\xb8\x8f\xf0\x9f\xa4\xa6\xf0\x9f\x8f\xbd\xe2\x80\x8d\xe2\x99\x80\xef\xb8\x8f',"b'2/2 belly after it hasn\xe2\x80\x99t been smooth sailing. Having suffered from sciatica, nerve pain and a slowly healing scar\xe2\x80\xa6 https://t.co/QMCVyThQPn'",b'YOUVE BEEN HIT BY\nYOUVE BEEN STRUCK BY\ndepression',"b'my son has anxiety and depression at the age of 11 this is a massive battle on and off since he was 6yrs, The last\xe2\x80\xa6 https://t.co/J7MDJYhR09'","b""Just, if you think you know someone struggling with depression... You can help just by treating them like they're a\xe2\x80\xa6 https://t.co/50OuuiNtOH""","b""But I constantly feel like I can Escape depression once I finish doing this one thing that's currently giving me an\xe2\x80\xa6 https://t.co/7NtyBRPyKC""",b'chronic fatigue and depression',b'Syuko Shiomi stole my Heart and Cured my Depression',"b'Or worse, the bit that my depression has a history of manifesting as: blind seething uncontrolled and unfocused rage.'","b'Everyone: ""There needs to be more talk about suicide, depression, etc."" \n*Something about suicide, depression, etc.\xe2\x80\xa6 https://t.co/wbEEhcjKoS'",b'Depression has really been kicking my ass recently and I\xe2\x80\x99m trying so hard to fight it.',b'Do you know someone who is currently working in primary care and want to learn more about mental health conditions\xe2\x80\xa6 https://t.co/okZKpB4M1P',b'May is Mental Health Awareness Month. Here some proven ways to help with depression are discussed. https://t.co/Gn4q0rxGVi',"b'its been social hours for the last 9 hours i couldnt fit in my usual after school depression nap but o k!!,,'","b""@toxtethtv #MentalHealthAwarenessWeek  don't bottle it up !! #stress #depression https://t.co/bldMXo1nrf""",b'where can i get a groot for myself just looking at baby groot cures my depression',"b""Alot of pple don't realize dt depression is an illness""",b'Work is pushing my buttons. I apologise in advance for the crippling depression that creeps in here in the next couple of days/weeks.',"b'me: exams are next week, but i\xe2\x80\x99m chill, it\xe2\x80\x99s fine, I\xe2\x80\x99ll pass\nanxiety and depression: https://t.co/3vFo6BrK8I'",b'Wow depression knows no one. https://t.co/rIDpTh3kLb',"b""\xf0\x9f\x98\xa9\xf0\x9f\x98\xa9\xf0\x9f\x98\xa9\xf0\x9f\x98\xa9\xf0\x9f\x98\xa9\xf0\x9f\x98\xa9\xf0\x9f\x98\xa9\xf0\x9f\x98\xa9\xf0\x9f\x98\xa9\xf0\x9f\x98\xa9\xf0\x9f\x98\xa9\xf0\x9f\x98\xa9\xf0\x9f\x98\xa9\xf0\x9f\x98\xa9\xf0\x9f\x98\xa9\xf0\x9f\x98\xa9\xf0\x9f\x98\xa9\xf0\x9f\x98\xa9\xf0\x9f\x98\xa9\xf0\x9f\x98\xa9\xf0\x9f\x98\xa9\ntriggered by this depression/suicide turn. it's too real.""","b""@pool55sw19 @TORIAP2 @Bristol_Jane @bo_novak Well if u want to call depression and suicidal thoughts self pity, I can't stop you.""",b'Been questioning a lot of my ideals and \xe2\x80\x9caspirations\xe2\x80\x9d lately and I\xe2\x80\x99m completely floored. \n\nLike... what security (r\xe2\x80\xa6 https://t.co/WuDVzRBmlm',b'@heyman_lee so much depression right now ...',b'My depression is genetic. I was literally born depressed. I realized I was depressed at 8 years old. I have an abus\xe2\x80\xa6 https://t.co/pHkcLPvb7p',"b'Dear @johngreen and @wilw, as someone who lives with anxiety and depression, my friends worry when I listen to\xe2\x80\xa6 https://t.co/JJbsvH7DUO'",b'Tired of feeling low - exploring the links between mental health and depression https://t.co/xE1uWBIPQo #MHAW18\xe2\x80\xa6 https://t.co/HIfkqww1kN',b'Depression and Video Games | Sidcourse https://t.co/1xua8LDyeD via @YouTube',"b'@clash_music @justplayed @Justplais I haven\xe2\x80\x99t yet, but I have Depression Cherry and Bloom on vinyl. Both sound bett\xe2\x80\xa6 https://t.co/HwUQ6EGT9w'",b'aint see her in about a week this depression got me weak',"b""@TheFlorrie #MentalHealthAwarnessWeek  don't bottle it up !!  #stress #depression https://t.co/dWo6ooCN4X""","b'It\xe2\x80\x99s finally here!!! #officialmishaappreciationday \nMisha, I don\xe2\x80\x99t know if you\xe2\x80\x99ll ever read this, but I want to say\xe2\x80\xa6 https://t.co/LA9lu3gVQ7'",b'@that1mum No mental illness is more worthy of attention than others- anxiety and depression are just more common.',"b'Mercurial King Alfonso XIII of Spain, born #otd 17-5-1886, d 1941, was prone to fits of depression.  His fondness f\xe2\x80\xa6 https://t.co/o3JYWKciYG'","b'Depression in men may lower chances for pregnancy, NIH study suggests - Washington Post https://t.co/7eCJMyCUxl'","b'Importance of public health interventions to modify our risk of dementia. Address loss of hearing, depression, soci\xe2\x80\xa6 https://t.co/Ca0nc60OdF'",b'@mcrownboy Depression',b'This depression level I\xe2\x80\x99ve reached is crazy',"b""It's OK to be who you are, it's OK to have scars. #MentalHealthAwarenessWeek #mentalhealth #MentalHealthAwareness #depression""",b'me: saihara-chan you look depressed\nsaihara: thanks its the depression',"b'Color therapy for the heavy hearted folks dealing with anxiety ,working through traumatic experiences ,depression ,\xe2\x80\xa6 https://t.co/Pmzg7fN47R'",b'Can people stop talking about depression like it\xe2\x80\x99s a choice?????',b'#Tomatoes reduce the risk of #depression\n\nhttps://t.co/2zH0N6idva',"b'Depression in men may lower chances for pregnancy, NIH study suggests https://t.co/P7H2pqOz5i https://t.co/9tBYKAVdLg'","b'""A Lancet Psychiatry study of 91,000 people found a disrupted body clock was linked with #depression,\xe2\x80\xa6 https://t.co/Zp2rPwlVO2'","b""\xe2\x80\x9cIf you don't think your anxiety, depression, sadness and stress impact your physical health, think again. All of t\xe2\x80\xa6 https://t.co/DXILdIhCCe""","b""Now I need depression pills on his behalf. \xf0\x9f\xa4\xa3\xf0\x9f\xa4\xa3\xf0\x9f\xa4\xa3\xf0\x9f\xa4\xa3\xf0\x9f\x98\x82\xf0\x9f\x98\x82\xf0\x9f\x98\x82 he's brilliant actually. I even saw captain Buthelezi kicking do\xe2\x80\xa6 https://t.co/qVhqFAxrKO""",b'Why the fuck do people always assume there needs to be a logical reason for someone to be depressed?? \n\nChemical im\xe2\x80\xa6 https://t.co/iBsSxVsqCq',b'Depression and stress coming to me again \xf0\x9f\x98\xa5\xf0\x9f\x98\xa9',b'@markrowland77 @SkySportsNews @CCforDD Great segment this morning! Thank you Clarke for using the platform you have\xe2\x80\xa6 https://t.co/3140ABxY2f',"b'#Lack of #sleep affects your #mood, your #hormonal #balance and can expose you to a greater risk of serious\xe2\x80\xa6 https://t.co/je8uLVwQIn'",b'Hi can I get uhhhhhhh a large cup of double depression and a shot of heartbreak thanks so much',b'@keith72088 @_kiki206 @soosoosenpai @bananasclips @pixeIbitch There are starving kids that are still the happiest p\xe2\x80\xa6 https://t.co/rR2LwjXIEo',b'Many people who suffer from depression have problems with their sleep. Find out more about how depression affects s\xe2\x80\xa6 https://t.co/gMeBGybTmA',b'Life story. Apply this to everything I do and you have depression and anxiety. https://t.co/lq1mGqaOX6',b'@Saphir1996 I wish I could promise you that depression just goes away but nah. But it\xe2\x80\x99ll be okay',b'My depression just smacked me in the face bro holy shit ! I can feel myself spiralling and I hate it . I hate feeling this way .',b'Pain is not always visible.\n\nI take an SSRI and anti-anxiety medication for panic and depression caused by PTSD. Th\xe2\x80\xa6 https://t.co/yRqCA2pAZc',"b'@MyBlackMatters 28 which is now lol but people are still tearing me down family they don\xe2\x80\x99t like my hair , they expe\xe2\x80\xa6 https://t.co/O8vysQKZXQ'",b'@MarvBernardo No zach nooooooooo. This person is depressed. That person is depressed. DAFUQ IS THIS!?!?!? The mille\xe2\x80\xa6 https://t.co/i010Y8zxkS',b'@MsLeaSalonga I mean pray tapos support and understand them and give them medical recovery. A friend of mine suffer\xe2\x80\xa6 https://t.co/6Kzqo6ZtRk',b'I liked a @YouTube video https://t.co/gzDU5Z2Htd The Science of Depression',b'the only that saved my depression #BLACKPINK_Coming_Back_Mid_June https://t.co/Kva4A8ie4t',b'i have depression https://t.co/dH9Y90Lb9w',"b'@LockedGenie I have also heard it first tym but I guess he provide cuddles to people in pain , depression so that t\xe2\x80\xa6 https://t.co/Do71qBEdiz'",b'5 stages of moving on: (MHH)\n\n1. Denial\n2. Anger\n3. Bargaining \n4. Depression\n5. ACCEPTANCE\n\nps: i heard an awful n\xe2\x80\xa6 https://t.co/7LSFnJFPlC',"b'A Son, a friend and career are some of the daily roles I fulfill in order to care for my Mother Xx who suffers from\xe2\x80\xa6 https://t.co/0muV56PRLt'",b'Wanna know a viscous cycle? I hate myself because im not happy. So because i hate myself it makes me more depressed\xe2\x80\xa6 https://t.co/d4lS3XCDlE',b'@Nino_Brown__ @bananasclips Not all parents know. People with mental illness like depression generally hide it very well unfortunately.',"b""I agree that terms like bipolar, ptsd, adhd and ocd shouldn't be used in an adjective sense. but anxiety and depres\xe2\x80\xa6 https://t.co/xqdkjWH79l""","b'Fucking done, all I want in life and all I\xe2\x80\x99ve ever really wanted is to fucking skate, I let heartbreak, depression\xe2\x80\xa6 https://t.co/l9oDoywsBl'",b'@iSOLACIUM I listened to a radio show on radio 2 this week where Professor Edward Bullman of Cambridge University w\xe2\x80\xa6 https://t.co/z0kZfUhW3v',b'@d9iva i fucking hate that racist depression faking bitch with a passion im so glad karma and all her ex friends are after her lnakdv',"b""#MHAW18 Clinical #depression: Lawrence's story - Lawrence has depression. He explains how easy it was to ignore the\xe2\x80\xa6 https://t.co/m8D8renIbd""",b'Know the signs of depression in children https://t.co/wkcO0W5Rfd',"b""I'm finding all signs of depression dawning on me.""",b'@MissRBaller Did you have depression when you are in highschool??',"b'Depression in men may lower chances for pregnancy, NIH study suggests - Washington Post https://t.co/m4U0KAUcOu'",b'The only time I\xe2\x80\x99m not competing to time is when this depression is haggling on my back',"b'It\xe2\x80\x99s #MentalHealthAwarenessWeek. This year\xe2\x80\x99s focus is #stress, with 1 in 6 adults in Britain experiencing stress-re\xe2\x80\xa6 https://t.co/z8pNAWWab2'","b""Really tough read but well worth it. Remarkable story. #MentalHealthAwarenessWeek ''I wanted to die, but I fought b\xe2\x80\xa6 https://t.co/fX2d2SoOgF""","b'In a study of more than 1,000 #seniors over five years, researchers @univmiami found that participants with this il\xe2\x80\xa6 https://t.co/udyPGp2Nuc'",b'https://t.co/3Y8mzN9ZqT My mother has been suffering from depression and stress-related issues for the last 5 years\xe2\x80\xa6 https://t.co/S80e9yZ1oO',"b'""Women are the people who are going to relieve us from all this oppression and https://t.co/1hrdSivPrq is the women\xe2\x80\xa6 https://t.co/6Q21hZSbho'",b'Same with depression https://t.co/JfL0bd5cZQ',"b'My mother has been suffering from depression and stress-related issues for the last 5 years. To find a way to cope,\xe2\x80\xa6 https://t.co/wcTr3j2IxO'","b""@y2bcrazy don't I know it :( it's really hard to push through depression to be an adult at times &amp; then it self-cycles""",b'#Postnatal Depression : Similar to perinatal depression but lasts longer then a year after the #birth of your\xe2\x80\xa6 https://t.co/OHALvW5hfH',b'Depression is the most common mental disorder and among the most disabling diseases in the world. Depression has se\xe2\x80\xa6 https://t.co/i217vE76qZ',"b'Just because you\xe2\x80\x99re struggling, that doesn\xe2\x80\x99t mean you\xe2\x80\x99re weak in your faith or that you\xe2\x80\x99re a bad Muslim. The Prophe\xe2\x80\xa6 https://t.co/k6VQ10UonN'","b'Just because you\xe2\x80\x99re struggling, that doesn\xe2\x80\x99t mean you\xe2\x80\x99re weak in your faith or that you\xe2\x80\x99re a bad Muslim. The Prophe\xe2\x80\xa6 https://t.co/9cCnb5LHQQ'","b'All you need to know about #AgitatedDepression.#depression.#Anxiety,#Tension,#MedicalResearch,#behavioralscience.\xe2\x80\xa6 https://t.co/DxjoebZOUT'","b'Just because you\xe2\x80\x99re privileged since born or golden spoon in other words, doesn\xe2\x80\x99t mean depression won\xe2\x80\x99t exist. It c\xe2\x80\xa6 https://t.co/6qEEBbEVTR'",b'Drifters normalize vapid depression',"b""My ISP has caused me so much depression and anxiety over the last 2 years. It's made it 10x harder to grow my strea\xe2\x80\xa6 https://t.co/6DYJy16rM2""","b'I gave an interview about cycling around the world, writing books and depression for @CyclingEurope. Listen online\xe2\x80\xa6 https://t.co/ydORLeMOIZ'","b'SkySportsBoxing """"I wanted to die, but I fought back."" \n\nLeonMckenzie1 on fight back from depression in the ring...\xe2\x80\xa6 https://t.co/1I0T9MNHJb'","b'#Stress can affect us mentally and physically, with 1 in 6 adults in Britain experiencing stress-related depression\xe2\x80\xa6 https://t.co/eElx4FqAYh'",b'Depression Draw\n.\n.\n.\n.\n#ink #handmade #draw\xe2\x80\xa6 https://t.co/kQ2zbT6Wdc',"b'@judeinlondon2 And whatever it is, if you ever need to talk, please dm. Been through tears of depression, anxiety,\xe2\x80\xa6 https://t.co/fj3xBBP5hQ'","b'Even the strongest of people that we look up to go through low points, depression, suicidal thoughts.\xe2\x80\xa6 https://t.co/u2boqVWE7g'",b'This disgusting annual sports franchise mixes bioluminescent life with depression and the player must stop immediately.',"b""@_ElizabethMay Ever since I saw your thread on Anxiety and Depression you've had a fan for life :)""",b'youtuber: the most problematic\ndepression: im not gonna shut up til you watch that shit\nme:',"b'oh depression, you\xe2\x80\x99ve come back to harass me again xD'",b'this will probably never happen again i can feel the crippling depression intensify https://t.co/dDVF6X6oPw',b'Two rules for peaceful life...\nDepression in failure\nShould never go to heart\nAnd ego in success should never\nGo to the brain \xe2\x9a\xa1\xe2\x9a\xa1\xe2\x9c\x8c\xef\xb8\x8f\xe2\x9c\x8c\xef\xb8\x8f',b'SUDDENLY MY DEPRESSION IS GONE AND I NO LONGER HAVE ANXIETY MY LIFE IS COMPLETE',"b'Sweet dreams everyone that can fall asleep without stress, depression, anxiety sweet wonderful dreams'",b'so causing young women/men to suffer from depression/anxiety at knowing when they go shopping with a friend they ha\xe2\x80\xa6 https://t.co/UZzZxBjvzG',b'@my250tweets im confused a pill for depression whose side effect is suicidal thoughts..\xf0\x9f\x98\xae\xf0\x9f\x98\xb1\xf0\x9f\x98\xb1',b'I am pretty sure that the reason my depression got worse over the years is because my creative expression has alway\xe2\x80\xa6 https://t.co/GwxiPXYjqa',"b""My mind is stuck daydreaming while my insomnia exhausts my brittle bones. \n\nOn the bright side, I'm no less motivat\xe2\x80\xa6 https://t.co/CCwU4UoZW9""","b""i know i shouldn't post this on here but i'm just so angry how can they call themselves therapeutical when the THER\xe2\x80\xa6 https://t.co/UUyD3J7sQJ""","b""I cannot watch this enough.\n\nYears ago, I battled depression @mauroranallo.  I wouldn't acknowledge it then, when i\xe2\x80\xa6 https://t.co/Eh94yeWLZG""",b'@CrankGameplays Making fun of depression are we?',b'&amp; look at em... all of them are black. I swear black ppl treat depression like it don\xe2\x80\x99t exist https://t.co/X3US5j5iU0',b'ah yes because that is just how depression works :) well done :)) https://t.co/jGUqZTAEiD',"b'@MforMagnanimous Well, you should! An episode of friends a day keeps depression away'",b'No one will understand until they can see how worse you are in the depression situation \xf0\x9f\x99\x82',"b'\xe2\x9d\x9dHonesty. That\xe2\x80\x99s good. \n\nCuntvin, man up. Admit you\xe2\x80\x99re sad one day and we\xe2\x80\x99ll be gucci. We can have depression cries\xe2\x80\xa6 https://t.co/9IXik58USj'","b'minty took some pics of me being a dick to someone, that\'s on me as a person, not my depression or because ""i need help""'",b'@applewriter Depression &amp; anxiety are deemed more socially acceptable. Personality disorders are extremely stigmati\xe2\x80\xa6 https://t.co/MMQHhxYrjN',b'Jordan Peterson: How To Deal With Depression | Powerful Motivational Speech\xc2\xa02018 https://t.co/n5ZrgZHGVi https://t.co/6VwH5C5V7c',"b'Sky News on People who exercise regularly are 16% less likely to develop depression, according to a major internati\xe2\x80\xa6 https://t.co/p6BWhN1prK'","b'\xf0\x9f\x9a\xa9 We provide psychosocial services to youth who are found to be unmotivated and are underachieving at school, as we\xe2\x80\xa6 https://t.co/Swi5fSK4VY'",b'I suffer with anxiety and post natal depression. For over a year I was too scared to take tablets but recently I de\xe2\x80\xa6 https://t.co/Gz2Bo49Zai',b'@bananasclips The cure to depression is a gratitude. A grateful heart finds the joy in the pain and us thankful for\xe2\x80\xa6 https://t.co/uNpDKif8EM',"b'IMI\xe2\x80\x99s PRISM project is studying social withdrawal, a symptom of #depression #schizophrenia &amp; #Alzheimer; results wi\xe2\x80\xa6 https://t.co/8R7PUUx5kK'","b'@yote I personally think alot of people misunderstand the difference between being ""Depressed"" &amp; having ""Depression\xe2\x80\xa6 https://t.co/DL54GtqvY4'",clockworkabe"b'""Smiling Depression"" https://t.co/Bg9NSbPCqg via @savisfab_12'",thejasminemariab'In the Spider\xe2\x80\x99s Web\xe2\x80\x94How I lived with Prenatal Depression. https://t.co/AeUoyIPM1d',4modernmysticsb'do you ever hear a song or a voice that perfectly encapsulates the specific way you experienced depression during a time in your life?',andromeda_volt"b""13.4% of Southwark's population reported depression and anxiety in 2014/15 - higher than the London average of 11.7\xe2\x80\xa6 https://t.co/YLpICHU1r3""",southwarkgiving"b'Pretty sure adult life starts before the age of 24 though. Also, your perception of depression is entirely skewed. https://t.co/X6fX8eGpEn'",_lucyrjones"b'i was such idiot for not connecting issues with my thyroid, gaining on weight and depression \xf0\x9f\xa4\xa6\xe2\x80\x8d\xe2\x99\x82\xef\xb8\x8f'",mr_gathb'@Slimeparty Lol i love that this not only sends the message that everyone 23 and under who has depression is just o\xe2\x80\xa6 https://t.co/bs9fw9DvhI',Pommedetear"b""dabbing stops depression trust me i've been dabbing for 2 years and all i'm sad about is how tired my arms are""",Spark1892"b'@COPEScotland Believes we need to ensure we think of the needs of fathers as well as mothers, including around Post\xe2\x80\xa6 https://t.co/H50A86Qoqr'",COPEScotland"b""@SchoolOfMovies' episode this week on Neverending Story is a really solid introspective show. The thoughtful discus\xe2\x80\xa6 https://t.co/YdnPMhSxqn""",TJungiusb'Your mental illnesses can really take over you and I\xe2\x80\x99m still learning to not let them. I highly recommend this book\xe2\x80\xa6 https://t.co/DbedkSVd2j',xchloRx"b'@pod_KAPAKA On top of that I have bursitis in both shoulders, degenerative arthritis in both knees, and tendinitis\xe2\x80\xa6 https://t.co/vKEYNzhJFZ'",NattieIsMyAngel"b'@KZUNCH I really hope your kid has depression at the age of 15 or so, i\xe2\x80\x99d love to see you tell him/her this.'",k47aleena"b'@poornabell @clairenelson Not true in my case. My wife deserted me, along with my 10 year old daughter as my reacti\xe2\x80\xa6 https://t.co/VSARn3pWw7'",rslaingb'Started to learn the basics of meditation and I\xe2\x80\x99ve done a couple of sessions already - it feels great. I have a lon\xe2\x80\xa6 https://t.co/qH3IcPmt4i',tommwolfeb'I like @xxxtentacion for being a huge campaigner against Depression #QuestionMark',SlaidOnNb'Depression does not discriminate. https://t.co/hTjRuzAOUz',iamrhondaab'4/5 badly by depression and agoraphobia...my cousins helped me to start jamming with them at home-we recorded and w\xe2\x80\xa6 https://t.co/pJSAcv9u2W',ColPmusicb'I liked a @YouTube video https://t.co/twr1HTNZVA summer depression / @buzry32',Rixzuh"b""Depression aka i haven't washed my hair in days and im tired even though all I've done is lay in bed all day""",Jasminem2620b'@EdnaOjeh \xf0\x9f\x98\x82\xf0\x9f\x98\x82\xf0\x9f\x98\x82\xf0\x9f\x98\x82Depression taking its toll',TaverAbahb'This is disappointing. Depression does not discriminate. https://t.co/512oo74SXX',AineODonnellx"b'@khaleesi_britt People who think ""depression"" means ""being a bit sad""...'",VeronicaAwakens"b""@HopeAtha who does that thou ? let's say they dont know whats depression. askies hope you find someone who might be\xe2\x80\xa6 https://t.co/fJSIsaq9HT""",soso_32t2b'Privilege can help you cope better what with more access to services and ability to take time off to heal but doesn\xe2\x80\xa6 https://t.co/5lKW6qUEEx',imaweeb