b'Buy Stilnoct CR 12.5mg Online To Solve insomnia Problem   https://t.co/WGRMZse4Ay  #health #ambien #stilnoct\xe2\x80\xa6 https://t.co/MsRCWWa8AS',Drugpillstore"b'We\xe2\x80\x99ve been doing great at raising awareness for anx and depression. Now we need to create a platform for psychosis,\xe2\x80\xa6 https://t.co/LuAYf9eEkl'",tibblepowell"b'@jaicpn I think the book shows how depression doesn\xe2\x80\x99t really go away easily(it needs time, care and hope) and how s\xe2\x80\xa6 https://t.co/z4gOykWtsu'",jaenehajar"b""I don't force myself now into doing some tasks because the effort is stressing me out. I just allow the depression\xe2\x80\xa6 https://t.co/3rPTRa9LbT""",fredaq8b'@Jacobji01 @prakashraaj We can understand your depression.',dhinamumravib'Depression. Mental illness. Misunderstood. Overlooked. Sad. Sad.\nMay she R.I.P.\nhttps://t.co/Ui8Pa8A4P1',IamEstaKimanib'Prevelance of Post stroke depression - is there a gender dofferenc? Do we brush it aside &amp; not actually consider it\xe2\x80\xa6 https://t.co/OFnhaO1ifu',drgmeredith"b'confusedthin: feathers-weightless: deaddei: Secrets like depression, eating disorders, self harm, or... https://t.co/0f3UeHvWV8'",Smile_Martinib'Me: joking abt my depression/anxiety helps\n\n\xe2\x80\x9cDude same\xe2\x80\x9d\n\nMe: The endless white noise that is our meaningless existe\xe2\x80\xa6 https://t.co/2eFxc1B3Fp',YvngSvicidxl_b'SPEAK UP SETX | Do you think depression is a problem in SETX?\nWatch your vote count on-air during 12News Daybreak.\xe2\x80\xa6 https://t.co/xUoVbayVNR',12NewsNowb'Rates of anxiety and depression in young people have increased by 70% over the past 25 years. Exam stress can contr\xe2\x80\xa6 https://t.co/7jLOzY2qpv',PHE_EastMidsb'Next talk by #profanthonycleare on optimising treatment in #depression https://t.co/mWHRy851Rh',Asifmbachlani"b""#depression, #suicide, frustration, fear, anger - are things many experience. Especially entrepreneurs. I'll speak\xe2\x80\xa6 https://t.co/L2gZhWgNhc""",ramonray"b'- an identifiable thing, how many asexuals would\xe2\x80\x99ve been misdiagnosed and treated for SAD, HSDD, depression, hormon\xe2\x80\xa6 https://t.co/0J8Oz82FBM'",enbylievable"b'Disruption of circadian rhythm is associated with #mood disorders, including depression and #bipolardisorder . https://t.co/JfnT1mR1wZ'",RROIJournalsb'Why be asleep of be doing homework when i can sink deeper in to a depression spiral lol',_primulumb'#MentalHealthWeek \nI\xe2\x80\x99ve been struggling with depression/ anxiety for years. I can finally say I\xe2\x80\x99m on the road to recovery \xf0\x9f\x99\x8c',spvnnerb'@sikka_harinder Hope wherever sehmat n her parents n husband who loved her so much that he sacrificed his own life\xe2\x80\xa6 https://t.co/5OYhHT3khr',Fasiha2002b'Male depression may cause infertility:\xc2\xa0study https://t.co/Cugseq1IlW https://t.co/kUlUjoWt0u',Great9ijab'Who else is up rn other than me and can\xe2\x80\x99t sleep through their depression ? \xf0\x9f\x92\x81\xf0\x9f\x8f\xbd\xe2\x80\x8d\xe2\x99\x80\xef\xb8\x8f\xf0\x9f\xa4\xa6\xf0\x9f\x8f\xbd\xe2\x80\x8d\xe2\x99\x80\xef\xb8\x8f',PxnkVelvets"b'2/2 belly after it hasn\xe2\x80\x99t been smooth sailing. Having suffered from sciatica, nerve pain and a slowly healing scar\xe2\x80\xa6 https://t.co/QMCVyThQPn'",Thirsty_Otterb'YOUVE BEEN HIT BY\nYOUVE BEEN STRUCK BY\ndepression',kiryu_ebooks"b'my son has anxiety and depression at the age of 11 this is a massive battle on and off since he was 6yrs, The last\xe2\x80\xa6 https://t.co/J7MDJYhR09'",strawberrybee76"b""Just, if you think you know someone struggling with depression... You can help just by treating them like they're a\xe2\x80\xa6 https://t.co/50OuuiNtOH""",Monika_chrbot"b""But I constantly feel like I can Escape depression once I finish doing this one thing that's currently giving me an\xe2\x80\xa6 https://t.co/7NtyBRPyKC""",wingedseahorseb'chronic fatigue and depression',karenmaezzzb'Syuko Shiomi stole my Heart and Cured my Depression',syukolovemail"b'Or worse, the bit that my depression has a history of manifesting as: blind seething uncontrolled and unfocused rage.'",twiddlekins"b'Everyone: ""There needs to be more talk about suicide, depression, etc."" \n*Something about suicide, depression, etc.\xe2\x80\xa6 https://t.co/wbEEhcjKoS'",scepticalxmirab'Depression has really been kicking my ass recently and I\xe2\x80\x99m trying so hard to fight it.',uhoh_haileyb'Do you know someone who is currently working in primary care and want to learn more about mental health conditions\xe2\x80\xa6 https://t.co/okZKpB4M1P',DRIVEsayshellob'May is Mental Health Awareness Month. Here some proven ways to help with depression are discussed. https://t.co/Gn4q0rxGVi',infernoashbee"b'its been social hours for the last 9 hours i couldnt fit in my usual after school depression nap but o k!!,,'",mangoepls"b""@toxtethtv #MentalHealthAwarenessWeek  don't bottle it up !! #stress #depression https://t.co/bldMXo1nrf""",Carlfletcher15b'where can i get a groot for myself just looking at baby groot cures my depression',snitchmagic"b""Alot of pple don't realize dt depression is an illness""",rudethrillerb'Work is pushing my buttons. I apologise in advance for the crippling depression that creeps in here in the next couple of days/weeks.',twiddlekins"b'me: exams are next week, but i\xe2\x80\x99m chill, it\xe2\x80\x99s fine, I\xe2\x80\x99ll pass\nanxiety and depression: https://t.co/3vFo6BrK8I'",boofrancescab'Wow depression knows no one. https://t.co/rIDpTh3kLb',ikejnr_23"b""\xf0\x9f\x98\xa9\xf0\x9f\x98\xa9\xf0\x9f\x98\xa9\xf0\x9f\x98\xa9\xf0\x9f\x98\xa9\xf0\x9f\x98\xa9\xf0\x9f\x98\xa9\xf0\x9f\x98\xa9\xf0\x9f\x98\xa9\xf0\x9f\x98\xa9\xf0\x9f\x98\xa9\xf0\x9f\x98\xa9\xf0\x9f\x98\xa9\xf0\x9f\x98\xa9\xf0\x9f\x98\xa9\xf0\x9f\x98\xa9\xf0\x9f\x98\xa9\xf0\x9f\x98\xa9\xf0\x9f\x98\xa9\xf0\x9f\x98\xa9\xf0\x9f\x98\xa9\ntriggered by this depression/suicide turn. it's too real.""",____notyourcuh"b""@pool55sw19 @TORIAP2 @Bristol_Jane @bo_novak Well if u want to call depression and suicidal thoughts self pity, I can't stop you.""",magicpillsJC23b'Been questioning a lot of my ideals and \xe2\x80\x9caspirations\xe2\x80\x9d lately and I\xe2\x80\x99m completely floored. \n\nLike... what security (r\xe2\x80\xa6 https://t.co/WuDVzRBmlm',Seyibabesb'@heyman_lee so much depression right now ...',peary_ab'My depression is genetic. I was literally born depressed. I realized I was depressed at 8 years old. I have an abus\xe2\x80\xa6 https://t.co/pHkcLPvb7p',Spiritdea"b'Dear @johngreen and @wilw, as someone who lives with anxiety and depression, my friends worry when I listen to\xe2\x80\xa6 https://t.co/JJbsvH7DUO'",archastrob'Tired of feeling low - exploring the links between mental health and depression https://t.co/xE1uWBIPQo #MHAW18\xe2\x80\xa6 https://t.co/HIfkqww1kN',thedreamsmavenb'Depression and Video Games | Sidcourse https://t.co/1xua8LDyeD via @YouTube',HELLHOUND906"b'@clash_music @justplayed @Justplais I haven\xe2\x80\x99t yet, but I have Depression Cherry and Bloom on vinyl. Both sound bett\xe2\x80\xa6 https://t.co/HwUQ6EGT9w'",Quickfallb'aint see her in about a week this depression got me weak',iammyscars___"b""@TheFlorrie #MentalHealthAwarnessWeek  don't bottle it up !!  #stress #depression https://t.co/dWo6ooCN4X""",Carlfletcher15"b'It\xe2\x80\x99s finally here!!! #officialmishaappreciationday \nMisha, I don\xe2\x80\x99t know if you\xe2\x80\x99ll ever read this, but I want to say\xe2\x80\xa6 https://t.co/LA9lu3gVQ7'",I_like_nougatb'@that1mum No mental illness is more worthy of attention than others- anxiety and depression are just more common.',laurabeth_xox"b'Mercurial King Alfonso XIII of Spain, born #otd 17-5-1886, d 1941, was prone to fits of depression.  His fondness f\xe2\x80\xa6 https://t.co/o3JYWKciYG'",madmonarchs"b'Depression in men may lower chances for pregnancy, NIH study suggests - Washington Post https://t.co/7eCJMyCUxl'",HealthyWrld"b'Importance of public health interventions to modify our risk of dementia. Address loss of hearing, depression, soci\xe2\x80\xa6 https://t.co/Ca0nc60OdF'",PetraCorrb'@mcrownboy Depression',HerdsThemib'This depression level I\xe2\x80\x99ve reached is crazy',dreadyoppa_josh"b""It's OK to be who you are, it's OK to have scars. #MentalHealthAwarenessWeek #mentalhealth #MentalHealthAwareness #depression""",SarcasticEnigmab'me: saihara-chan you look depressed\nsaihara: thanks its the depression',ouma_enbot"b'Color therapy for the heavy hearted folks dealing with anxiety ,working through traumatic experiences ,depression ,\xe2\x80\xa6 https://t.co/Pmzg7fN47R'",LosesofGainesb'Can people stop talking about depression like it\xe2\x80\x99s a choice?????',xtessafcab'#Tomatoes reduce the risk of #depression\n\nhttps://t.co/2zH0N6idva',HamdanMedical"b'Depression in men may lower chances for pregnancy, NIH study suggests https://t.co/P7H2pqOz5i https://t.co/9tBYKAVdLg'",dramollette"b'""A Lancet Psychiatry study of 91,000 people found a disrupted body clock was linked with #depression,\xe2\x80\xa6 https://t.co/Zp2rPwlVO2'",TweetingAutism"b""\xe2\x80\x9cIf you don't think your anxiety, depression, sadness and stress impact your physical health, think again. All of t\xe2\x80\xa6 https://t.co/DXILdIhCCe""",frommetoyou01"b""Now I need depression pills on his behalf. \xf0\x9f\xa4\xa3\xf0\x9f\xa4\xa3\xf0\x9f\xa4\xa3\xf0\x9f\xa4\xa3\xf0\x9f\x98\x82\xf0\x9f\x98\x82\xf0\x9f\x98\x82 he's brilliant actually. I even saw captain Buthelezi kicking do\xe2\x80\xa6 https://t.co/qVhqFAxrKO""",CoolKid_Skinnyb'Why the fuck do people always assume there needs to be a logical reason for someone to be depressed?? \n\nChemical im\xe2\x80\xa6 https://t.co/iBsSxVsqCq',mhopsicleb'Depression and stress coming to me again \xf0\x9f\x98\xa5\xf0\x9f\x98\xa9',shaXarmyblink97b'@markrowland77 @SkySportsNews @CCforDD Great segment this morning! Thank you Clarke for using the platform you have\xe2\x80\xa6 https://t.co/3140ABxY2f',RedGeekMusings"b'#Lack of #sleep affects your #mood, your #hormonal #balance and can expose you to a greater risk of serious\xe2\x80\xa6 https://t.co/je8uLVwQIn'",ndtv_doctorb'Hi can I get uhhhhhhh a large cup of double depression and a shot of heartbreak thanks so much',carinarizonab'@keith72088 @_kiki206 @soosoosenpai @bananasclips @pixeIbitch There are starving kids that are still the happiest p\xe2\x80\xa6 https://t.co/rR2LwjXIEo',imtheonlytyeb'Many people who suffer from depression have problems with their sleep. Find out more about how depression affects s\xe2\x80\xa6 https://t.co/gMeBGybTmA',_sleepstationb'Life story. Apply this to everything I do and you have depression and anxiety. https://t.co/lq1mGqaOX6',_taboojub'@Saphir1996 I wish I could promise you that depression just goes away but nah. But it\xe2\x80\x99ll be okay',Che3fNuggzb'My depression just smacked me in the face bro holy shit ! I can feel myself spiralling and I hate it . I hate feeling this way .',lulyassib'Pain is not always visible.\n\nI take an SSRI and anti-anxiety medication for panic and depression caused by PTSD. Th\xe2\x80\xa6 https://t.co/yRqCA2pAZc',MrsEmma"b'@MyBlackMatters 28 which is now lol but people are still tearing me down family they don\xe2\x80\x99t like my hair , they expe\xe2\x80\xa6 https://t.co/O8vysQKZXQ'",AshleyL25b'@MarvBernardo No zach nooooooooo. This person is depressed. That person is depressed. DAFUQ IS THIS!?!?!? The mille\xe2\x80\xa6 https://t.co/i010Y8zxkS',beatboyxalbertb'@MsLeaSalonga I mean pray tapos support and understand them and give them medical recovery. A friend of mine suffer\xe2\x80\xa6 https://t.co/6Kzqo6ZtRk',leaga317b'I liked a @YouTube video https://t.co/gzDU5Z2Htd The Science of Depression',Aidan_Rorieb'the only that saved my depression #BLACKPINK_Coming_Back_Mid_June https://t.co/Kva4A8ie4t',ChaeLisa_JenChub'i have depression https://t.co/dH9Y90Lb9w',shojous"b'@LockedGenie I have also heard it first tym but I guess he provide cuddles to people in pain , depression so that t\xe2\x80\xa6 https://t.co/Do71qBEdiz'",shhhhhhreyab'5 stages of moving on: (MHH)\n\n1. Denial\n2. Anger\n3. Bargaining \n4. Depression\n5. ACCEPTANCE\n\nps: i heard an awful n\xe2\x80\xa6 https://t.co/7LSFnJFPlC',forsythiaaaa"b'A Son, a friend and career are some of the daily roles I fulfill in order to care for my Mother Xx who suffers from\xe2\x80\xa6 https://t.co/0muV56PRLt'",robabdulb'Wanna know a viscous cycle? I hate myself because im not happy. So because i hate myself it makes me more depressed\xe2\x80\xa6 https://t.co/d4lS3XCDlE',MartinProdYTb'@Nino_Brown__ @bananasclips Not all parents know. People with mental illness like depression generally hide it very well unfortunately.',imtheonlytye"b""I agree that terms like bipolar, ptsd, adhd and ocd shouldn't be used in an adjective sense. but anxiety and depres\xe2\x80\xa6 https://t.co/xqdkjWH79l""",plasticballpit"b'Fucking done, all I want in life and all I\xe2\x80\x99ve ever really wanted is to fucking skate, I let heartbreak, depression\xe2\x80\xa6 https://t.co/l9oDoywsBl'",JonasRogers2b'@iSOLACIUM I listened to a radio show on radio 2 this week where Professor Edward Bullman of Cambridge University w\xe2\x80\xa6 https://t.co/z0kZfUhW3v',flangiepangeb'@d9iva i fucking hate that racist depression faking bitch with a passion im so glad karma and all her ex friends are after her lnakdv',paxxpi"b""#MHAW18 Clinical #depression: Lawrence's story - Lawrence has depression. He explains how easy it was to ignore the\xe2\x80\xa6 https://t.co/m8D8renIbd""",RBHT_Libraryb'Know the signs of depression in children https://t.co/wkcO0W5Rfd',GenesisMedical"b""I'm finding all signs of depression dawning on me.""",lilzameeb'@MissRBaller Did you have depression when you are in highschool??',LeopoldoDLagma1"b'Depression in men may lower chances for pregnancy, NIH study suggests - Washington Post https://t.co/m4U0KAUcOu'",healthy_wrldb'The only time I\xe2\x80\x99m not competing to time is when this depression is haggling on my back',paraeuinoia"b'It\xe2\x80\x99s #MentalHealthAwarenessWeek. This year\xe2\x80\x99s focus is #stress, with 1 in 6 adults in Britain experiencing stress-re\xe2\x80\xa6 https://t.co/z8pNAWWab2'",SARIcharity"b""Really tough read but well worth it. Remarkable story. #MentalHealthAwarenessWeek ''I wanted to die, but I fought b\xe2\x80\xa6 https://t.co/fX2d2SoOgF""",RJConway92"b'In a study of more than 1,000 #seniors over five years, researchers @univmiami found that participants with this il\xe2\x80\xa6 https://t.co/udyPGp2Nuc'",Being_Patient_b'https://t.co/3Y8mzN9ZqT My mother has been suffering from depression and stress-related issues for the last 5 years\xe2\x80\xa6 https://t.co/S80e9yZ1oO',picsreddit"b'""Women are the people who are going to relieve us from all this oppression and https://t.co/1hrdSivPrq is the women\xe2\x80\xa6 https://t.co/6Q21hZSbho'",Dept_of_Womenb'Same with depression https://t.co/JfL0bd5cZQ',xFFASCE"b'My mother has been suffering from depression and stress-related issues for the last 5 years. To find a way to cope,\xe2\x80\xa6 https://t.co/wcTr3j2IxO'",sergiomgm7"b""@y2bcrazy don't I know it :( it's really hard to push through depression to be an adult at times &amp; then it self-cycles""",kuraineb'#Postnatal Depression : Similar to perinatal depression but lasts longer then a year after the #birth of your\xe2\x80\xa6 https://t.co/OHALvW5hfH',DelicatFragilb'Depression is the most common mental disorder and among the most disabling diseases in the world. Depression has se\xe2\x80\xa6 https://t.co/i217vE76qZ',Acmp_ng"b'Just because you\xe2\x80\x99re struggling, that doesn\xe2\x80\x99t mean you\xe2\x80\x99re weak in your faith or that you\xe2\x80\x99re a bad Muslim. The Prophe\xe2\x80\xa6 https://t.co/k6VQ10UonN'",Zikraz1"b'Just because you\xe2\x80\x99re struggling, that doesn\xe2\x80\x99t mean you\xe2\x80\x99re weak in your faith or that you\xe2\x80\x99re a bad Muslim. The Prophe\xe2\x80\xa6 https://t.co/9cCnb5LHQQ'",Zikraz1"b'All you need to know about #AgitatedDepression.#depression.#Anxiety,#Tension,#MedicalResearch,#behavioralscience.\xe2\x80\xa6 https://t.co/DxjoebZOUT'",Shyam17"b'Just because you\xe2\x80\x99re privileged since born or golden spoon in other words, doesn\xe2\x80\x99t mean depression won\xe2\x80\x99t exist. It c\xe2\x80\xa6 https://t.co/6qEEBbEVTR'",syyhiodineb'Drifters normalize vapid depression',boat_rho"b""My ISP has caused me so much depression and anxiety over the last 2 years. It's made it 10x harder to grow my strea\xe2\x80\xa6 https://t.co/6DYJy16rM2""",dellorlol"b'I gave an interview about cycling around the world, writing books and depression for @CyclingEurope. Listen online\xe2\x80\xa6 https://t.co/ydORLeMOIZ'",NextChallenge"b'SkySportsBoxing """"I wanted to die, but I fought back."" \n\nLeonMckenzie1 on fight back from depression in the ring...\xe2\x80\xa6 https://t.co/1I0T9MNHJb'",Boxing_Today"b'#Stress can affect us mentally and physically, with 1 in 6 adults in Britain experiencing stress-related depression\xe2\x80\xa6 https://t.co/eElx4FqAYh'",MiddlewichHighb'Depression Draw\n.\n.\n.\n.\n#ink #handmade #draw\xe2\x80\xa6 https://t.co/kQ2zbT6Wdc',Darknox1895"b'@judeinlondon2 And whatever it is, if you ever need to talk, please dm. Been through tears of depression, anxiety,\xe2\x80\xa6 https://t.co/fj3xBBP5hQ'",JuveUnited"b'Even the strongest of people that we look up to go through low points, depression, suicidal thoughts.\xe2\x80\xa6 https://t.co/u2boqVWE7g'",Plus_Fabulosityb'This disgusting annual sports franchise mixes bioluminescent life with depression and the player must stop immediately.',GamesAreStupid"b""@_ElizabethMay Ever since I saw your thread on Anxiety and Depression you've had a fan for life :)""",emperorpuprtineb'youtuber: the most problematic\ndepression: im not gonna shut up til you watch that shit\nme:',cosmicgerardway"b'oh depression, you\xe2\x80\x99ve come back to harass me again xD'",targarianneb'this will probably never happen again i can feel the crippling depression intensify https://t.co/dDVF6X6oPw',thyichorb'Two rules for peaceful life...\nDepression in failure\nShould never go to heart\nAnd ego in success should never\nGo to the brain \xe2\x9a\xa1\xe2\x9a\xa1\xe2\x9c\x8c\xef\xb8\x8f\xe2\x9c\x8c\xef\xb8\x8f',Itz_me_Bunny